{"attempted_task_ids":["M4.2-NUC-A-F"],"batch_order":["M4.2-BATCH-NUC","M4.2-BATCH-MEC","M4.2-BATCH-ELE","M4.2-BATCH-AUT","M4.2-BATCH-COM","M4.2-BATCH-MPH"],"counts":{"aggregation_calls":0,"attempts":1,"finalizations":0,"followups":0,"judge_calls":0,"repairs":0,"results":0,"retries":0,"side_effects":0,"tasks":0,"threads":0},"create_thread_responses":[],"dispatch_receipts":[],"failed_batch":"M4.2-BATCH-NUC","failed_stage":"create_thread_response_raw_capture","failed_task_id":"M4.2-NUC-A-F","failure_evidence":{"diagnostic":"create_thread_response_raw_capture","failure_class":"INFRASTRUCTURE_FAILURE","raw_evidence_byte_length":258,"raw_evidence_path":"C:\\Users\\94310\\AppData\\Local\\Temp\\m42-gate-b-live-a008922c043042959bd846c03ee171f9\\orchestrator-failure.txt","raw_evidence_sha256":"0aec98854d451f36e8b903707eaf7708bfba68e004c8d0189976bf7bdcda166c"},"gate_a_acceptance":{"candidate_head":"9869aa4b22b5097619ce18b896a1c2b6e631e58b","pr_run_id":31683144534,"push_run_id":31683141775},"last_completed_batch":null,"later_batches_not_started":["M4.2-BATCH-MEC","M4.2-BATCH-ELE","M4.2-BATCH-AUT","M4.2-BATCH-COM","M4.2-BATCH-MPH"],"launch_claim":{"claim_id":"a5827070-eb51-597b-ad26-5cf19fc51929","path":"evals/m4/execution/m4.2/launch-claim.json","raw_sha256":"bfd80ebba9b8e672f19a9837391cce1d0b41826cd3d04b8f0f1953f5b94bb3b8"},"milestone":"M4","permissions_still_closed":["second claim","partial-matrix claim","retry","repair","follow-up message","cross-task result read","cross-arm result read","blind-map access","unblinding","judge execution","aggregation","threshold decision","M4 closure","M5"],"raw_finals":[],"recorded_at_utc":"2026-08-13T09:11:01Z","revision":"M4.2","schema_version":"m4.2-execution-terminal-v1","successor_revision_required":true,"terminal_state":"STOPPED_PROTOCOL_OR_INFRASTRUCTURE_FAILURE"}
